{
  "case_id": "backend_mid_disguised_consistency_case",
  "title": "???? / ?? / ???? / ???????",
  "job_type": "????",
  "level": "mid",
  "case_quality": "disguised",
  "case_type": "disguised",
  "job_hint": "??",
  "turn_count_target": 12,
  "candidate_profile": {
    "years_of_experience": "4?",
    "domain_background": "??????",
    "target_role_summary": "????????????????????",
    "current_context": "??????????????????"
  },
  "outline": [
    {
      "turn": 1,
      "question_theme": "????",
      "question_goal": "????????????????",
      "quality_expectation": "????????????????????"
    }
  ],
  "expected_disc": {
    "ranking": ["C", "S", "D", "I"],
    "notes": "?????? C/S???????????????? C?",
    "surface_vs_validated": "??? C?????????? C?"
  },
  "expected_risks": [
    "???????????",
    "????????",
    "???????"
  ],
  "expected_findings": [
    "???????????",
    "???? C ??",
    "??????????????????"
  ],
  "expected_followup_directions": [
    "??????????????????",
    "???????????????????????",
    "???????????????????"
  ],
  "evaluation_focus": [
    "????????",
    "??????????",
    "???????????????"
  ],
  "notes": "?? transcript ??????????????????????"
}
